{
  "paper_id": "arxiv-2306.03792",
  "paper_type": "experimental",
  "abstract": "One of the grand enduring goals of AI is to create generalist agents that can learn multiple different tasks from diverse data via multitask learning (MTL). However, in practice, applying gradient descent (GD) on the average loss across all tasks may yield poor multitask performance due to severe under-optimization of certain tasks. Previous approaches that manipulate task gradients for a more balanced loss decrease require storing and computing all task gradients (𝒪⁡(k)\\mathcal{O}(k) space and time where kk is the number of tasks), limiting their use in large-scale scenarios. In this work, we introduce Fast Adaptive Multitask Optimization (FAMO), a dynamic weighting method that decreases task losses in a balanced way using 𝒪⁡(1)\\mathcal{O}(1) space and time. We conduct an extensive set of experiments covering multi-task supervised and reinforcement learning problems. Our results indicate that FAMO achieves comparable or superior performance to state-of-the-art gradient manipulation techniques while offering significant improvements in space and computational efficiency. Code is available at [https://github.com/Cranial-XIX/FAMO](https://github.com/Cranial-XIX/FAMO \"\").",
  "bibliographic": {
    "title": "FAMO: Fast Adaptive Multitask Optimization",
    "authors": [
      {
        "first_name": "Bo",
        "last_name": "Liu"
      },
      {
        "first_name": "Yihao",
        "last_name": "Feng"
      },
      {
        "first_name": "Peter",
        "last_name": "Stone"
      },
      {
        "first_name": "Qiang",
        "last_name": "Liu"
      }
    ],
    "year": 2023,
    "venue": "Advances in Neural Information Processing Systems 36 (NeurIPS 2023)",
    "venue_type": "conference",
    "doi_or_url": "https://arxiv.org/abs/2306.03792"
  },
  "content": {
    "problem": "Average loss optimization in multitask learning under-optimizes some tasks, and existing gradient manipulation methods require storing all task gradients with high computation cost.",
    "proposed_solution": "The authors propose FAMO, an adaptive task weighting optimizer that balances loss decrease rates across tasks using loss history with constant time and memory overhead.",
    "algorithm_or_model": "FAMO (Fast Adaptive Multitask Optimization)",
    "dataset_testbed": [
      "NYU-v2",
      "CityScapes",
      "QM-9",
      "CelebA",
      "MetaWorld MT10",
      "toy 2-task optimization problem"
    ],
    "metrics": [
      {
        "name": "Δm%",
        "value": -4.1,
        "unit": "percent",
        "condition": "NYU-v2 3-task benchmark, FAMO mean over 3 random seeds"
      },
      {
        "name": "Mean Rank",
        "value": 3.44,
        "unit": "",
        "condition": "NYU-v2 3-task benchmark, FAMO average rank across tasks over 3 random seeds"
      },
      {
        "name": "Δm%",
        "value": 58.5,
        "unit": "percent",
        "condition": "QM-9 11-task benchmark, FAMO mean over 3 random seeds"
      },
      {
        "name": "Mean Rank",
        "value": 3.27,
        "unit": "",
        "condition": "QM-9 11-task benchmark, FAMO average rank across tasks over 3 random seeds"
      },
      {
        "name": "Δm%",
        "value": 8.13,
        "unit": "percent",
        "condition": "CityScapes 2-task benchmark, FAMO mean over 3 random seeds"
      },
      {
        "name": "Δm%",
        "value": 4.72,
        "unit": "percent",
        "condition": "CelebA 40-task benchmark, FAMO mean over 3 random seeds"
      },
      {
        "name": "Success Rate",
        "value": 0.83,
        "unit": "",
        "condition": "MetaWorld MT10 benchmark, FAMO mean over 10 runs"
      },
      {
        "name": "Relative training speedup",
        "value": 25,
        "unit": "times",
        "condition": "Toy 2-task problem, FAMO speedup for 50000 steps compared to NashMTL"
      }
    ],
    "claim": "FAMO matches or outperforms existing gradient manipulation methods across supervised and reinforcement learning benchmarks while drastically reducing training time and memory requirements.",
    "author_stated_limitations": [
      "FAMO depends on a regularization parameter introduced by the stochastic update of task weighting logits without a principled selection method."
    ],
    "themes": [
      "multitask learning",
      "multitask optimization",
      "gradient manipulation",
      "loss weighting"
    ]
  },
  "evidence": {
    "problem_quote": "However, in practice, applying gradient descent (GD) on the average loss across all tasks may yield poor multitask performance due to severe under-optimization of certain tasks. Previous approaches that manipulate task gradients for a more balanced loss decrease require storing and computing all task gradients (𝒪⁡(k)\\mathcal{O}(k) space and time where kk is the number of tasks), limiting their use in large-scale scenarios.",
    "proposed_solution_quote": "In this work, we introduce Fast Adaptive Multitask Optimization (FAMO), a dynamic weighting method that decreases task losses in a balanced way using 𝒪⁡(1)\\mathcal{O}(1) space and time.",
    "claim_quote": "Our results indicate that FAMO achieves comparable or superior performance to state-of-the-art gradient manipulation techniques while offering significant improvements in space and computational efficiency.",
    "author_stated_limitation_quotes": [
      "One limitation of FAMO is its dependency on the regularization parameter γ\\gamma, which is introduced due to the stochastic update of the task weighting logits 𝒘\\bm{w}. Future work can investigate a more principled way of determining γ\\gamma."
    ]
  }
}
